{
  "version": 1,
  "scope": "local",
  "updated_at": 1749600000,
  "tools": [
    {
      "name": "supabase",
      "scope": "local",
      "type": "mcp",
      "capabilities": ["database", "sql", "migrations", "edge-functions", "logs"],
      "description": "Supabase MCP — execute SQL, apply migrations, tail logs, and manage edge functions for the service backend.",
      "invocation": "mcp__Supabase__execute_sql",
      "when": "user asks about the database schema, wants to run a query, apply a migration, or inspect Supabase logs",
      "tags": ["db", "backend"],
      "pinned": true,
      "added": "2026-06-11"
    },
    {
      "name": "sentry",
      "scope": "local",
      "type": "mcp",
      "capabilities": ["error-tracking", "issue-search", "performance"],
      "description": "Sentry MCP — search issues, inspect error traces, and triage production panics without leaving the session.",
      "invocation": "mcp__Sentry__search_issues",
      "when": "user mentions a crash, panic, production error, or wants to check Sentry for recent issues",
      "tags": ["observability", "prod"],
      "pinned": false,
      "added": "2026-06-11"
    },
    {
      "name": "fly",
      "scope": "local",
      "type": "cli",
      "capabilities": ["deploy", "scale", "secrets", "logs", "ssh"],
      "description": "Fly.io CLI — deploy the service node/worker images, manage secrets, tail live logs, and open remote shells.",
      "invocation": "fly",
      "when": "user wants to deploy, scale, inspect live logs, or SSH into a Fly machine",
      "tags": ["infra", "deploy"],
      "pinned": false,
      "added": "2026-06-11"
    },
    {
      "name": "service-dev",
      "scope": "local",
      "type": "cli",
      "capabilities": ["local-run", "seed-db", "test-circuit"],
      "description": "Project-local dev harness (`just dev`). Boots the node + worker locally, seeds the Supabase shadow DB, and runs circuit unit tests.",
      "invocation": "just dev",
      "when": "user wants to run the full local stack, seed data, or iterate on circuit logic without a remote deploy",
      "tags": ["dev", "local"],
      "pinned": false,
      "added": "2026-06-11"
    }
  ]
}
